{
  "form": "abrechnung",
  "document": "urn:uuid:8c41e2d7-0f5a-4b93-a6e8-1d2c3b4a5f70",
  "status": "draft",
  "values": {
    "name": null,
    "personalnummer": null,
    "abteilung": null,
    "zweck": null,
    "ziel": null,
    "reisetag": null,
    "dauer_stunden": null,
    "tagesgeld": 0,
    "anreise": null,
    "kennzeichen": null,
    "kilometer": null,
    "kilometergeld": null,
    "fahrkarten": null,
    "parken": null,
    "sonstige_auslagen": null,
    "vorschuss": null,
    "summe": 0,
    "auszahlung": 0,
    "iban": null,
    "angaben_richtig": false
  }
}
